easyjet,positive,1.00E+17,Thu Oct 20 04:39:07 +0000 2011, No problem and thank you for your kind words. If you require any further information please do 
easyjet,positive,1.00E+17,Thu Oct 20 04:39:06 +0000 2011,Thank you for letting me know. Very quick response. Excellent customer service! :)
easyjet,positive,1.00E+17,Thu Oct 20 04:37:34 +0000 2011,Okay. Our passenger's health and safety is our number one priority
easyjet,positive,1.00E+17,Thu Oct 20 04:37:33 +0000 2011, Thank you for your kind words . I am glad the airport were able to sort this for her! 
easyjet,positive,1.00E+17,Thu Oct 20 04:40:56 +0000 2011,Thank you for the brilliant customer service demonstrated to my student daughter this Christmas!
easyjet,positive,1.00E+17,Thu Oct 20 04:40:56 +0000 2011,Done  thanks 
easyjet,positive,1.00E+17,Thu Oct 20 04:39:30 +0000 2011, I am glad to hear that you were able to check in at the airport 
easyjet,negative,1.00E+17,Thu Oct 20 04:40:39 +0000 2011, At Rome no information prior to getting here. Rude staff and two hour delay. None of your trackers show this information.
easyjet,positive,1.00E+17,Thu Oct 20 04:40:37 +0000 2011, Ok cheers pal!
easyjet,positive,1.00E+17,Thu Oct 20 04:40:08 +0000 2011, Thanks I booked easyjet quickly as there are a lot of people here with all AirFrance flight
easyjet,negative,1.00E+17,Thu Oct 20 04:39:07 +0000 2011,Disgusting customer service. Shame on you deleting comments
easyjet,negative,1.00E+17,Thu Oct 20 04:41:02 +0000 2011, Due to continued poor weather conditions some flights may be delayed or cancelled.
easyjet,negative,1.00E+17,Thu Oct 20 04:40:56 +0000 2011,The extremely rude and unhelpful employee @Gatwick_Airport is pictured. He said he did not work for @easyJet
easyjet,negative,1.00E+17,Thu Oct 20 04:41:02 +0000 2011, at the airport and flight ezy8355 is cancelled. Please update your website so I can book a hotel
easyjet,negative,1.00E+17,Thu Oct 20 04:40:47 +0000 2011,How is my flight now delayed by 2 hours 30 minutes???? Seems only easyJet flights are delayed
easyjet,negative,1.00E+17,Thu Oct 20 04:40:39 +0000 2011, get me home for fuck sake
easyjet,negative,1.00E+17,Thu Oct 20 04:40:37 +0000 2011, At least have your staff announce in airport and update the display system it is not really easy !
easyjet,positive,1.00E+17,Thu Oct 20 04:40:08 +0000 2011, Excellent news!
easyjet,positive,1.00E+17,Thu Oct 20 04:39:35 +0000 2011,Very grateful to be taking off from Stansted this evening we feel very lucky. Big thanks to the @easyJet
easyjet,negative,1.00E+17,Thu Oct 20 04:39:30 +0000 2011,5 cancelled flights. YOU HAVING A LAUGH EASYJET
easyjet,negative,1.00E+17,Thu Oct 20 04:39:07 +0000 2011, Lack of information is terrible
easyjet,positive,1.00E+17,Thu Oct 20 04:38:47 +0000 2011, Hope everything works out for you. Have fun in Katerini. I also have relatives there too.
easyjet,negative,1.00E+17,Thu Oct 20 04:37:33 +0000 2011, Dog shit easyjet for you
easyjet,negative,1.00E+17,Thu Oct 20 04:40:56 +0000 2011, That is a joke.
easyjet,negative,1.00E+17,Thu Oct 20 04:41:02 +0000 2011,Seriously @easyJet ? Do not mind all the safety procedures but still sitting on tarmac 1.5 hours